{
  "provisional_disease": "Myelodysplastic neoplasm",
  "morphologic_diagnosis_origin": "supplied",
  "bootstrap_cmcs": [
    "MDS"
  ],
  "variants": [
    {
      "variant_id": "V1",
      "gene": "SRSF2",
      "description": "SRSF2 p.P95H"
    }
  ],
  "detected_variants_summary": "One variant was detected in SRSF2.",
  "case_facts": [
    {
      "fact_id": "C1",
      "kind": "blast percentage",
      "value": "4%"
    }
  ]
}
